language,abstract,keywords,introduction,methods,results,discussion,references
english,abstract,keyword; keywords; subjects,introduction; background,methods; methodology; materials and methods; material and methods,results; results and conclusions,discussion; conclusions,literature cited; works cited; references; citations
spanish,resumen,palabras clave,introduccion,metodos; metodologia; materiales y metodos; material y metodo; materiales y metodo,resultados; resultados y conclusiones; resultados y discusion,discusion; discusion y conclusiones,literatura citada; bibliografia; referencias; trabajos citados; referencias bibliograficas
portuguese,resumo ,palavras-chave; palavras chave,introducao,metodologia; material e metodos; metodos,resultados; resultados e discussao,discussao; discussao e conclusao,referencias bibliograficas; trabalhos citados; referencias; literatura citada; referencias
french,Resumes,mots cles; mots-cles,introduction; introduction et definitions,methodologie; methodes,resultats; premier resultats,discussion,references; references bibliographiques
norwegian, sammendrag; abstract, keywords; nøkkelord, innledning, metoder; metoder og materiale, resultat, diskusjon; oppsummering og diskusjon, referanser
